date,episode_id,decision_id,decision,status,source_path,notes
2026-06-09,s01e05-apartment-window-longplay,D000,Open Gate 0 scaffold for Apartment Window Longplay,scaffolded_source_only,channel/episodes/s01e05-apartment-window-longplay/manifest.json,No provider media render export upload public publish or rights/platform approval
2026-06-09,s01e05-apartment-window-longplay,D001,Lock Gate 1 source packet,locked,channel/episodes/s01e05-apartment-window-longplay/manifest.json,Song titles lyrics Suno fields visual prompts metadata and comment are synced and locked
2026-06-09,s01e05-apartment-window-longplay,D002,Approve Gate 2 preview and media intake,approved_source_only,channel/episodes/s01e05-apartment-window-longplay/reviews/audio-candidate-intake.md,All 13 selected audio tracks (c01) and pool tracks (c02) organized. Selected background image (vis-c01) copy approved.
2026-06-11,s01e05-apartment-window-longplay,D003,Private video upload executed,video_uploaded_private,channel/episodes/s01e05-apartment-window-longplay/reviews/release-decision-plan.md,YouTube Data API videos.insert completed with video ID ShWN-wK-ZNY
2026-06-11,s01e05-apartment-window-longplay,D004,Thumbnail set upload executed,thumbnail_uploaded,channel/episodes/s01e05-apartment-window-longplay/reviews/release-decision-plan.md,YouTube Data API thumbnails.set completed for video ID ShWN-wK-ZNY
2026-06-11,s01e05-apartment-window-longplay,D005,Public release visibility updated,video_published_public,channel/episodes/s01e05-apartment-window-longplay/reviews/release-decision-plan.md,YouTube Data API videos.update completed to set visibility to public for ShWN-wK-ZNY
2026-06-11,s01e05-apartment-window-longplay,D006,Post top-level comment thread,comment_posted,channel/episodes/s01e05-apartment-window-longplay/reviews/release-decision-plan.md,YouTube Data API commentThreads.insert completed with comment ID UgyS7hWhDBqla58T9214AaABAg
